[
  {
    "id": "TRN-0001",
    "case_id": "CASE-0001",
    "sequence": 1,
    "kind": "message",
    "audience": "everyone",
    "author_role": "customer",
    "author_id": "CUS-0001",
    "text": "<redacted-sample-text>",
    "language": "pt",
    "created_at": "2026-03-02T14:00:00Z",
    "client_message_id": "cm-1"
  },
  {
    "id": "TRN-0002",
    "case_id": "CASE-0001",
    "sequence": 2,
    "kind": "routing",
    "audience": "staff",
    "author_role": "system",
    "author_id": null,
    "text": "assigned",
    "language": "pt",
    "created_at": "2026-03-02T14:00:00Z",
    "client_message_id": null
  }
]
